<?xml version="1.0" encoding="UTF-8"?>
<jobPlans  xmlns:xsi="http://www.w3.org/2001/XMLSchema-instance"
	xsi:noNamespaceSchemaLocation="job_executor_jobplan.xsd">
	
 <jobPlan id="1" name="test1" type="distributed" ignoreError="true" cronType="simple" cronExpression="120">
		<start to="fork1" />
		<fork name="fork1" joinName="join1">
			<path to="executor_action1" />
			<path to="executor2_action1" />
		</fork>
		<action name="executor_action1" delayTime="1" delayType="soft" executorClusterID="ZY_Executor_Test">
			<job mode="script" executeUser="zhangxianquan">
				<executionContent>test/shell/xJobA1.sh</executionContent>
				<jobClassName>com.zhangyue.hella.common.model.ShellXjob</jobClassName>
				<args>XJob_A1</args>
				<description>This is first job on executor : ZY_Executor_Test.</description>
			</job>
			<ok to="executor_action2" />
			<error to="fail" />
		</action>
		<action name="executor_action2" delayTime="1" delayType="soft" executorClusterID="ZY_Executor_Test">
			<job mode="script" executeUser="zhangxianquan">
				<executionContent>test/shell/xJobA2.sh</executionContent>
				<jobClassName>com.zhangyue.hella.common.model.ShellXjob</jobClassName>
				<args>XJob_A2</args>
				<description>This is second job on executor : ZY_Executor_Test.</description>
			</job>
			<ok to="join1" />
			<error to="fail" />
		</action>
		<action name="executor2_action1" delayTime="1" delayType="soft" executorClusterID="ZY_Executor2_Test">
			<job mode="script" executeUser="zhangxianquan">
				<executionContent>test/shell/xJobB1.sh</executionContent>
				<jobClassName>com.zhangyue.hella.common.model.ShellXjob</jobClassName>
				<args>XJob_B1</args>
				<description>This is first job on executor : ZY_Executor2_Test.</description>
			</job>
			<ok to="executor2_action2" />
			<error to="fail" />
		</action>
		<action name="executor2_action2" delayTime="1" delayType="soft" executorClusterID="ZY_Executor2_Test">
			<job mode="script" executeUser="zhangxianquan">
				<executionContent>test/shell/xJobB2.sh</executionContent>
				<jobClassName>com.zhangyue.hella.common.model.ShellXjob</jobClassName>
				<args>XJob_B2</args>
				<description>This is second job on executor : ZY_Executor2_Test.</description>
			</job>
			<ok to="join1" />
			<error to="fail" />
		</action>
		<join name="join1" forkName="fork1" to="merge_action" />
		<action name="merge_action" delayTime="1" delayType="soft" executorClusterID="ZY_Executor_Test">
			<job mode="script" executeUser="zhangxianquan">
				<executionContent>test/shell/xJobC.sh</executionContent>
				<jobClassName>com.zhangyue.hella.common.model.ShellXjob</jobClassName>
				<args>XJob_C</args>
				<description>This is last job on executor : ZY_Executor_Test and merge above job output.</description>
			</job>
			<ok to="end" />
			<error to="fail" />
		</action>
		<fail name="fail" />
		<end name="end" />
	</jobPlan>
	
</jobPlans>
